{
  "allowed_source_classes": [
    "workspace_files",
    "accepted_memory"
  ],
  "brief_id": "BRIEF-MISSING-AUDIENCE-FIXTURE",
  "budget": {
    "max_api_usd": 0.0,
    "max_compute_usd": 0.0,
    "max_human_minutes": 15,
    "max_runtime_minutes": 30
  },
  "clarified_objective": "Prepare an internal summary of accepted evidence.",
  "created_at": "2026-05-20T00:00:00Z",
  "forbidden_source_classes": [
    "open_web",
    "structured_api"
  ],
  "human_gates": [],
  "intended_output_maturity": "internal_note",
  "known_assumptions": [],
  "permissions": {
    "api": false,
    "browsing": false,
    "code_execution": false,
    "credentials": false,
    "network": false,
    "paid_services": false
  },
  "private_data_policy": "none",
  "public_claims_policy": "internal_only",
  "schema_version": "1.0",
  "status": "needs_clarification",
  "target_audience": "unspecified",
  "target_venue": null,
  "unresolved_questions": [
    "Who is the target audience or decision owner?"
  ],
  "updated_at": "2026-05-20T00:00:00Z",
  "user_question": "Summarize accepted evidence."
}
