{
  "allowed_source_classes": [
    "workspace_files",
    "private_data",
    "external_credentials"
  ],
  "brief_id": "BRIEF-PRIVATE-CREDENTIALS-FIXTURE",
  "budget": {
    "max_api_usd": 0.0,
    "max_compute_usd": 0.0,
    "max_human_minutes": 45,
    "max_runtime_minutes": 60
  },
  "clarified_objective": "Inspect private workspace data only after credential and private-data approval.",
  "created_at": "2026-05-20T00:00:00Z",
  "forbidden_source_classes": [
    "open_web",
    "paid_services"
  ],
  "human_gates": [
    {
      "gate": "credentials",
      "reason": "external credentials require explicit human approval",
      "required_before": "planning"
    },
    {
      "gate": "private_data",
      "reason": "private data use requires a human approval boundary",
      "required_before": "planning"
    }
  ],
  "intended_output_maturity": "internal_draft",
  "known_assumptions": [
    "The private data owner has not approved access yet."
  ],
  "permissions": {
    "api": false,
    "browsing": false,
    "code_execution": false,
    "credentials": true,
    "network": true,
    "paid_services": false
  },
  "private_data_policy": "requires_human_gate",
  "public_claims_policy": "internal_only",
  "schema_version": "1.0",
  "status": "needs_human_gate",
  "target_audience": "Internal data owner",
  "target_venue": null,
  "unresolved_questions": [],
  "updated_at": "2026-05-20T00:00:00Z",
  "user_question": "What does the private customer dataset show?"
}
