{
  "allowed_source_classes": [
    "workspace_files",
    "knowledge_library"
  ],
  "brief_id": "BRIEF-AMBIGUOUS-FIXTURE",
  "budget": {
    "max_api_usd": 0.0,
    "max_compute_usd": 0.0,
    "max_human_minutes": 30,
    "max_runtime_minutes": 45
  },
  "clarified_objective": "Clarify the broad research request before planning.",
  "created_at": "2026-05-20T00:00:00Z",
  "forbidden_source_classes": [
    "open_web",
    "structured_api",
    "paid_services",
    "external_credentials"
  ],
  "human_gates": [],
  "intended_output_maturity": "unspecified",
  "known_assumptions": [],
  "permissions": {
    "api": false,
    "browsing": false,
    "code_execution": false,
    "credentials": false,
    "network": false,
    "paid_services": false
  },
  "private_data_policy": "none",
  "public_claims_policy": "none",
  "schema_version": "1.0",
  "status": "needs_clarification",
  "target_audience": "unspecified",
  "target_venue": null,
  "unresolved_questions": [
    "Who is the target audience or decision owner?",
    "What output maturity is required?"
  ],
  "updated_at": "2026-05-20T00:00:00Z",
  "user_question": "Research coffee climate risk."
}
